{
  "schema_version": "1.0",
  "as_of": "2026-10-13",
  "scope": "46 records resolved from public products.js; not independent manufacturer validation",
  "products": [
    {
      "id": "monster-3in1-ticket",
      "name": "Monster 3 in 1 Ticket",
      "category": "combo",
      "relationship": "manufacturer_site_catalogue",
      "manufacturer": null,
      "short_description": "3-in-1 Amusement Machine: Boxer, Kicker & Hammer\n\nThis innovative 3-in-1 arcade machine combines three popular strength-testing games in one compact unit — Boxer, Kicker, and Hammer.\n\nPlayers can test their power by choosing between punching, kicking, or hammering modes, all integrated into a single durable and eye-catching cabinet.\n\nThe machine features a modern design with LED lighting, high-quality sensors for accurate scoring\n\nPerfect for bars, amusement centers, and events, it offers maximum entertainment value while saving space.",
      "applications": null,
      "features": [
        "Built for heavy use, the 3-in-1 Boxer/Kicker/Hammer guarantees fun, competition, and excitement for players of all ages."
      ],
      "options": [
        "Bill acceptor.",
        "Nayax device.",
        "Ticket dispenser.",
        "Custom sticker and branding (Advance orders).",
        "Silent mode (Advance orders)."
      ],
      "colors": [
        {
          "id": "white",
          "name": "White",
          "image": "/assets/products/monster-3in1-ticket-white.webp"
        },
        {
          "id": "orange",
          "name": "Orange",
          "image": "/assets/products/monster-3in1-ticket-orange.webp"
        },
        {
          "id": "yellow",
          "name": "Yellow",
          "image": "/assets/products/monster-3in1-ticket-yellow.webp"
        },
        {
          "id": "green",
          "name": "Green",
          "image": "/assets/products/monster-3in1-ticket-green.webp"
        },
        {
          "id": "blue",
          "name": "Blue",
          "image": "/assets/products/monster-3in1-ticket-blue.webp"
        },
        {
          "id": "red",
          "name": "Red",
          "image": "/assets/products/monster-3in1-ticket-red.webp"
        },
        {
          "id": "black",
          "name": "Black",
          "image": "/assets/products/monster-3in1-ticket-black.webp"
        }
      ],
      "technical_specifications": {
        "Height": "230 cm / 91″",
        "Width": "140 cm / 56″",
        "Length": "140 cm / 56″",
        "Weight": "250 kg / 552 lb"
      },
      "official_url": "https://www.progamespoland.com/en/products/monster-3in1-ticket.html",
      "polish_url": "https://www.progamespoland.com/pl/produkty/monster-3in1-ticket.html",
      "source_ids": [
        "official-products-js"
      ],
      "verified_at": "2026-10-13",
      "approval_status": "source_verified_human_pending",
      "confidence": "high_for_source_transcription_not_independent_product_certification",
      "evidence": {
        "name": {
          "source_id": "official-products-js",
          "locator": "window.PRODUCTS['monster-3in1-ticket'].name"
        },
        "category": {
          "source_id": "official-products-js",
          "locator": "window.PRODUCTS['monster-3in1-ticket'].category"
        },
        "short_description": {
          "source_id": "official-products-js",
          "locator": "window.PRODUCTS['monster-3in1-ticket'].desc"
        },
        "features": {
          "source_id": "official-products-js",
          "locator": "window.PRODUCTS['monster-3in1-ticket'].features"
        },
        "options": {
          "source_id": "official-products-js",
          "locator": "window.PRODUCTS['monster-3in1-ticket'].options"
        },
        "colors": {
          "source_id": "official-products-js",
          "locator": "window.PRODUCTS['monster-3in1-ticket'].variants"
        },
        "technical_specifications": {
          "source_id": "official-products-js",
          "locator": "window.PRODUCTS['monster-3in1-ticket'].spec"
        }
      },
      "legacy_source_url_unverified": "https://www.progamespoland.com/monster-3in1-ticket",
      "source_copy_status_unverified": "matched",
      "availability": null,
      "price": null,
      "certifications": null
    },
    {
      "id": "monster-3in1",
      "name": "Monster 3 in 1",
      "category": "combo",
      "relationship": "manufacturer_site_catalogue",
      "manufacturer": null,
      "short_description": "3-in-1 Amusement Machine: Boxer, Kicker & Hammer\n\nThis innovative 3-in-1 arcade machine combines three popular strength-testing games in one compact unit — Boxer, Kicker, and Hammer.\n\nPlayers can test their power by choosing between punching, kicking, or hammering modes, all integrated into a single durable and eye-catching cabinet.\n\nThe machine features a modern design with LED lighting, high-quality sensors for accurate scoring\n\nPerfect for bars, amusement centers, and events, it offers maximum entertainment value while saving space.",
      "applications": null,
      "features": [
        "Built for heavy use, the 3-in-1 Boxer/Kicker/Hammer guarantees fun, competition, and excitement for players of all ages."
      ],
      "options": [
        "Bill acceptor.",
        "Nayax device.",
        "Ticket dispenser.",
        "Custom sticker and branding (Advance orders).",
        "Silent mode (Advance orders)."
      ],
      "colors": [
        {
          "id": "red",
          "name": "Red",
          "image": "/assets/products/monster-3in1-red.webp"
        },
        {
          "id": "black",
          "name": "Black",
          "image": "/assets/products/monster-3in1-black.webp"
        },
        {
          "id": "white",
          "name": "White",
          "image": "/assets/products/monster-3in1-white.webp"
        },
        {
          "id": "yellow",
          "name": "Yellow",
          "image": "/assets/products/monster-3in1-yellow.webp"
        },
        {
          "id": "blue",
          "name": "Blue",
          "image": "/assets/products/monster-3in1-blue.webp"
        },
        {
          "id": "orange",
          "name": "Orange",
          "image": "/assets/products/monster-3in1-orange.webp"
        }
      ],
      "technical_specifications": {
        "Height": "230 cm / 91″",
        "Width": "140 cm / 56″",
        "Length": "140 cm / 56″",
        "Weight": "250 kg / 552 lb"
      },
      "official_url": "https://www.progamespoland.com/en/products/monster-3in1.html",
      "polish_url": "https://www.progamespoland.com/pl/produkty/monster-3in1.html",
      "source_ids": [
        "official-products-js"
      ],
      "verified_at": "2026-10-13",
      "approval_status": "source_verified_human_pending",
      "confidence": "high_for_source_transcription_not_independent_product_certification",
      "evidence": {
        "name": {
          "source_id": "official-products-js",
          "locator": "window.PRODUCTS['monster-3in1'].name"
        },
        "category": {
          "source_id": "official-products-js",
          "locator": "window.PRODUCTS['monster-3in1'].category"
        },
        "short_description": {
          "source_id": "official-products-js",
          "locator": "window.PRODUCTS['monster-3in1'].desc"
        },
        "features": {
          "source_id": "official-products-js",
          "locator": "window.PRODUCTS['monster-3in1'].features"
        },
        "options": {
          "source_id": "official-products-js",
          "locator": "window.PRODUCTS['monster-3in1'].options"
        },
        "colors": {
          "source_id": "official-products-js",
          "locator": "window.PRODUCTS['monster-3in1'].variants"
        },
        "technical_specifications": {
          "source_id": "official-products-js",
          "locator": "window.PRODUCTS['monster-3in1'].spec"
        }
      },
      "legacy_source_url_unverified": "https://www.progamespoland.com/monster-3w1",
      "source_copy_status_unverified": "matched",
      "availability": null,
      "price": null,
      "certifications": null
    },
    {
      "id": "double-hit",
      "name": "Double Hit",
      "category": "combo",
      "relationship": "manufacturer_site_catalogue",
      "manufacturer": null,
      "short_description": "Offers two exciting challenges in one compact machine with vibrant LED lights that bring extra attraction. Press the top Start button to release the punchball and test your strength or hit the bottom button to kick the football and show off your skills. Double the action, all in one game!",
      "applications": null,
      "features": [
        "Thrilling gameplay: Captivates players with exciting challenges that test their strength, ensuring they stay engaged and keep coming back for more fun.",
        "Unmatched Durability & Convenience: Built with premium electronics and tough mechanics, making it perfect for high-traffic venues. Plus, it accepts bills, coins, cards, and tokens for seamless transactions.",
        "Boost Your Profits: Adjustable difficulty settings and free play modes to increase engagement and driving higher revenue."
      ],
      "options": [
        "Bill acceptor.",
        "Nayax device.",
        "Ticket dispenser.",
        "Custom sticker and branding (Advance orders).",
        "Silent mode (Advance orders)."
      ],
      "colors": [
        {
          "id": "red",
          "name": "Red",
          "image": "/assets/products/double-hit-red.webp"
        },
        {
          "id": "black",
          "name": "Black",
          "image": "/assets/products/double-hit-black.webp"
        },
        {
          "id": "white",
          "name": "White",
          "image": "/assets/products/double-hit-white.webp"
        },
        {
          "id": "orange",
          "name": "Orange",
          "image": "/assets/products/double-hit-orange.webp"
        },
        {
          "id": "blue",
          "name": "Blue",